{
  "schema_version": 1,
  "id": "cve-lookup",
  "title": "CVE lookup",
  "role": "Security engineers and anyone triaging vulnerability reports",
  "saves": "Building NVD links by hand when a CVE id shows up in a ticket or chat",
  "summary": "Type or paste a CVE id. Bolt offers its NVD link and a Markdown link, ready to copy.",
  "author": { "name": "Sparcle", "link": "https://sparcle.app" },
  "tier": 2,
  "permissions": ["copies_to_clipboard", "reads_launcher_input"],
  "tests": [
    {
      "kind": "recognizer",
      "name": "recognizes CVE ids and nothing else",
      "target": "cve",
      "positive": ["CVE-2024-3094", "CVE-2021-44228", "CVE-2023-1234567"],
      "negative": ["CVE", "CVE-2024", "CVE-24-3094", "ABC-2024-3094", "cve 2024 3094", "see CVE-2024-3094 for details", "2024-3094"],
      "expect_rep": [
        { "input": "CVE-2021-44228", "label": "NVD link", "value": "https://nvd.nist.gov/vuln/detail/CVE-2021-44228" },
        { "input": "CVE-2021-44228", "label": "Markdown", "value": "[CVE-2021-44228](https://nvd.nist.gov/vuln/detail/CVE-2021-44228)" }
      ]
    }
  ]
}
